0, 1, great product!, I love this product and use it often., 2021-09-10 13:12:58, 2021-09-10 13:18:58, 4
1, 1, awful products., Their products break after purchase., 2021-09-11 16:12:58, 2021-09-12 16:12:58, 1
2, 1, worth the purchase!, I am so glad I bought this., 2021-10-10 12:34:59, NULL, 5
3, 1, it broke., This product fell apart when I unpacked it., 2021-10-10 01:12:31, NULL, 1
4, 1, recommend., I think it is worth the money., 2021-10-10 09:25:00, 2021-10-11 10:27:01, 4
5, 1, everyone should invest!, this product really upgraded my look!, 2021-10-10 12:30:30, NULL, 5